{"attachments":[{"attachment_id":"ATT-SAMPLE","byte_size":8881957,"mime":"application/pdf","original_name":"샘플.pdf","proposed_role":"CASE_DRAWING","role":null,"role_confirmation":null,"sha256":"4105698c88ec34b3e590e7d93fc7e51e9c942c98ec966b483549b02ad369abc4","stored_path":"inputs/original/ATT-SAMPLE.pdf"}],"case_id":"CASE-PR58-SAMPLE","format":"evidence-review/review-request","question":"Review the provided sample drawing evidence and its confirmed calibration.","version":1}
